{
  "$schema": "https://json-schema.org/draft/2020-12/schema",
  "$id": "https://github.com/sean-m-cooper/CodeMetrics.AI/shared/scorecard-schema/evidence.schema.v3.json",
  "title": "CodeMetrics.AI Evidence v3",
  "type": "object",
  "required": [
    "schemaVersion",
    "generatedAtUtc",
    "tool",
    "subject",
    "filters",
    "population",
    "dimensions",
    "analysis"
  ],
  "additionalProperties": false,
  "properties": {
    "schemaVersion": {
      "const": 3
    },
    "generatedAtUtc": {
      "type": "string",
      "format": "date-time"
    },
    "tool": {
      "type": "object",
      "required": [
        "name",
        "version",
        "ecosystem"
      ],
      "additionalProperties": false,
      "properties": {
        "name": {
          "type": "string",
          "minLength": 1
        },
        "version": {
          "type": "string",
          "minLength": 1
        },
        "ecosystem": {
          "enum": [
            "dotnet",
            "javascript-typescript",
            "python",
            "rust"
          ]
        }
      }
    },
    "subject": {
      "type": "object",
      "required": [
        "root",
        "entryPoint"
      ],
      "additionalProperties": false,
      "properties": {
        "root": {
          "type": "string",
          "minLength": 1
        },
        "entryPoint": {
          "type": "string",
          "minLength": 1
        },
        "name": {
          "type": "string"
        },
        "variant": {
          "type": "string"
        }
      }
    },
    "filters": {
      "type": "object",
      "required": [
        "totalUnits",
        "analyzedUnits",
        "skipped"
      ],
      "additionalProperties": false,
      "properties": {
        "totalUnits": {
          "type": "integer",
          "minimum": 0
        },
        "analyzedUnits": {
          "type": "integer",
          "minimum": 0
        },
        "skipped": {
          "type": "array",
          "items": {
            "type": "object",
            "required": [
              "name",
              "reason"
            ],
            "additionalProperties": false,
            "properties": {
              "name": {
                "type": "string",
                "minLength": 1
              },
              "reason": {
                "type": "string",
                "minLength": 1
              }
            }
          }
        }
      }
    },
    "population": {
      "type": "object",
      "required": [
        "types",
        "members"
      ],
      "additionalProperties": false,
      "properties": {
        "types": {
          "type": "integer",
          "minimum": 0
        },
        "members": {
          "type": "integer",
          "minimum": 0
        }
      }
    },
    "dimensions": {
      "type": "object",
      "required": [
        "codeQuality",
        "maintainability",
        "errorHandling",
        "performanceAsync",
        "security",
        "testing",
        "documentation",
        "dependencyManagement",
        "architecture"
      ],
      "additionalProperties": false,
      "properties": {
        "codeQuality": {
          "$ref": "#/$defs/dimensionResult"
        },
        "maintainability": {
          "$ref": "#/$defs/dimensionResult"
        },
        "errorHandling": {
          "$ref": "#/$defs/dimensionResult"
        },
        "performanceAsync": {
          "$ref": "#/$defs/dimensionResult"
        },
        "security": {
          "$ref": "#/$defs/dimensionResult"
        },
        "testing": {
          "$ref": "#/$defs/dimensionResult"
        },
        "documentation": {
          "$ref": "#/$defs/dimensionResult"
        },
        "dependencyManagement": {
          "$ref": "#/$defs/dimensionResult"
        },
        "architecture": {
          "$ref": "#/$defs/dimensionResult"
        }
      }
    },
    "analysis": {
      "type": "object",
      "additionalProperties": false,
      "required": [
        "status",
        "ruleset",
        "calibration",
        "configurationFingerprint",
        "diagnostics",
        "suppressions"
      ],
      "properties": {
        "status": {
          "enum": [
            "complete",
            "incomplete"
          ]
        },
        "ruleset": {
          "type": "string",
          "minLength": 1
        },
        "calibration": {
          "enum": [
            "baseline",
            "uncalibrated",
            "calibrated"
          ]
        },
        "configurationFingerprint": {
          "type": "string",
          "minLength": 1
        },
        "diagnostics": {
          "type": "array",
          "items": {
            "type": "object",
            "required": [
              "kind",
              "message"
            ],
            "properties": {
              "kind": {
                "type": "string"
              },
              "message": {
                "type": "string"
              },
              "project": {
                "type": "string"
              }
            },
            "additionalProperties": false
          }
        },
        "suppressions": {
          "type": "array",
          "items": {
            "type": "object",
            "required": [
              "file",
              "line",
              "categories",
              "status"
            ],
            "properties": {
              "file": {
                "type": "string"
              },
              "line": {
                "type": "integer",
                "minimum": 1
              },
              "categories": {
                "type": "array",
                "items": {
                  "type": "string"
                }
              },
              "reason": {
                "type": [
                  "string",
                  "null"
                ]
              },
              "status": {
                "enum": [
                  "declared",
                  "applied"
                ]
              }
            },
            "additionalProperties": false
          }
        },
        "runId": {
          "type": "string",
          "format": "uuid"
        },
        "auditId": {
          "type": "string",
          "format": "uuid"
        }
      }
    }
  },
  "$defs": {
    "dimensionResult": {
      "type": "object",
      "required": [
        "status",
        "basis",
        "findings"
      ],
      "properties": {
        "status": {
          "enum": [
            "scored",
            "skipped",
            "failed"
          ]
        },
        "score": {
          "type": "number",
          "minimum": 0,
          "maximum": 10
        },
        "basis": {
          "type": "string",
          "minLength": 1
        },
        "findings": {
          "type": "array",
          "items": {
            "$ref": "#/$defs/finding"
          }
        },
        "scope": {
          "type": "object",
          "additionalProperties": false,
          "required": [
            "id",
            "coverage",
            "includes",
            "excludes"
          ],
          "properties": {
            "id": {
              "type": "string",
              "minLength": 1
            },
            "coverage": {
              "enum": [
                "partial",
                "unsupported"
              ]
            },
            "includes": {
              "type": "array",
              "items": {
                "type": "string",
                "minLength": 1
              }
            },
            "excludes": {
              "type": "array",
              "items": {
                "type": "string",
                "minLength": 1
              }
            }
          }
        },
        "scoringDecision": {
          "$ref": "#/$defs/scoringDecision"
        }
      },
      "additionalProperties": true,
      "if": {
        "properties": {
          "status": {
            "const": "scored"
          }
        },
        "required": [
          "status"
        ]
      },
      "then": {
        "required": [
          "score"
        ]
      },
      "else": {
        "not": {
          "anyOf": [
            {
              "required": [
                "score"
              ]
            },
            {
              "required": [
                "scoringDecision"
              ]
            }
          ]
        }
      }
    },
    "finding": {
      "type": "object",
      "required": [
        "category",
        "severity",
        "message",
        "ruleId",
        "fingerprint",
        "confidence",
        "observations"
      ],
      "additionalProperties": false,
      "properties": {
        "category": {
          "type": "string",
          "minLength": 1
        },
        "severity": {
          "enum": [
            "info",
            "warning",
            "error"
          ]
        },
        "file": {
          "type": "string"
        },
        "line": {
          "type": "integer",
          "minimum": 0
        },
        "project": {
          "type": "string"
        },
        "type": {
          "type": "string"
        },
        "member": {
          "type": "string"
        },
        "package": {
          "type": "string"
        },
        "confidence": {
          "enum": [
            "high",
            "medium",
            "low"
          ]
        },
        "message": {
          "type": "string",
          "minLength": 1
        },
        "ruleId": {
          "type": "string",
          "minLength": 1
        },
        "fingerprint": {
          "type": "string",
          "pattern": "^[0-9a-f]{64}$"
        },
        "observations": {
          "type": "object"
        }
      }
    },
    "scoringDecision": {
      "type": "object",
      "additionalProperties": false,
      "required": [
        "version",
        "policy",
        "operation",
        "finalScore",
        "inputs",
        "steps",
        "findingEffects"
      ],
      "properties": {
        "version": {
          "const": 1
        },
        "policy": {
          "type": "string",
          "minLength": 1
        },
        "operation": {
          "enum": [
            "firstMatch",
            "minimum",
            "mean",
            "deductions"
          ]
        },
        "finalScore": {
          "type": "number",
          "minimum": 0,
          "maximum": 10
        },
        "inputs": {
          "type": "object"
        },
        "steps": {
          "type": "array",
          "minItems": 1,
          "items": {
            "$ref": "#/$defs/scoringStep"
          }
        },
        "findingEffects": {
          "type": "array",
          "items": {
            "$ref": "#/$defs/findingScoreEffect"
          }
        }
      }
    },
    "scoringStep": {
      "type": "object",
      "additionalProperties": false,
      "required": [
        "id",
        "kind",
        "score",
        "disposition",
        "inputs",
        "findingCategories"
      ],
      "properties": {
        "id": {
          "type": "string",
          "minLength": 1
        },
        "kind": {
          "enum": [
            "rule",
            "component",
            "cap"
          ]
        },
        "score": {
          "type": "number",
          "minimum": 0,
          "maximum": 10
        },
        "condition": {
          "type": [
            "string",
            "null"
          ]
        },
        "matched": {
          "type": [
            "boolean",
            "null"
          ]
        },
        "disposition": {
          "enum": [
            "selected",
            "shadowed",
            "notMatched",
            "contributing",
            "notLimiting",
            "applied"
          ]
        },
        "inputs": {
          "type": "object"
        },
        "findingCategories": {
          "type": "array",
          "items": {
            "type": "string",
            "minLength": 1
          }
        },
        "decision": {
          "anyOf": [
            {
              "$ref": "#/$defs/scoringDecision"
            },
            {
              "type": "null"
            }
          ]
        }
      }
    },
    "findingScoreEffect": {
      "type": "object",
      "additionalProperties": false,
      "required": [
        "fingerprint",
        "category",
        "effect",
        "stepIds"
      ],
      "properties": {
        "fingerprint": {
          "type": "string",
          "pattern": "^[0-9a-f]{64}$"
        },
        "category": {
          "type": "string",
          "minLength": 1
        },
        "effect": {
          "enum": [
            "policyInput",
            "excluded",
            "noAdditionalReduction"
          ]
        },
        "stepIds": {
          "type": "array",
          "items": {
            "type": "string",
            "minLength": 1
          }
        }
      }
    }
  }
}
