{
  "schemaVersion": 3,
  "generatedAtUtc": "2026-10-15T15:36:30.002Z",
  "tool": {
    "name": "CodeMetrics.AI.Python",
    "version": "0.10.0",
    "ecosystem": "python"
  },
  "subject": {
    "root": "E:\\repos\\CodeMetrics.AI\\TestResults\\python-error-transfers-package-2026-10-15\\report-source",
    "entryPoint": "E:\\repos\\CodeMetrics.AI\\TestResults\\python-error-transfers-package-2026-10-15\\report-source",
    "name": "report-source",
    "variant": "source"
  },
  "filters": {
    "totalUnits": 1,
    "analyzedUnits": 1,
    "skipped": []
  },
  "population": {
    "types": 0,
    "members": 7
  },
  "dimensions": {
    "codeQuality": {
      "status": "scored",
      "basis": "Method Complexity of selected production implementations. Decomposition, duplication and coverage/CRAP are unscored review evidence.",
      "scope": {
        "id": "python/method-complexity-worst-40-remainder-60/v1",
        "coverage": "partial",
        "includes": [
          "selected-production-function-complexity"
        ],
        "excludes": [
          "test-support-generated-scoring",
          "decomposition-scoring",
          "duplication-scoring",
          "coverage-crap-scoring",
          "runtime-performance",
          "semantic-validation"
        ]
      },
      "findings": [],
      "duplication": {
        "schemaVersion": 1,
        "artifactKind": "experimental-python-duplication-review",
        "producer": {
          "name": "codemetrics-ai/python-duplication",
          "version": "0.1.0-experimental"
        },
        "generatedAtUtc": "2026-10-15T15:36:29.937054+00:00",
        "runId": "fdaf3d3c-1104-4bc4-8871-4eead80eda10",
        "auditId": "fdaf3d3c-1104-4bc4-8871-4eead80eda10",
        "status": "complete",
        "policy": "python/exact-function-body-v1",
        "configuration": {
          "policy": "python/exact-function-body-v1",
          "minimumStatements": 5,
          "selectionFingerprint": "1d376bba0c4e13b51a1c1898d7200fdfb6cccdeeeef74cc2424fd0659b8d756e",
          "parserVersion": "3.12.10",
          "maxOwners": 100000,
          "maxNormalizedBytes": 67108864
        },
        "configurationFingerprint": "8735dea6ca0bfb56f25bcc1de8b28b0edfb5085db518f66a8284606f4f351f26",
        "subject": {
          "root": "E:\\repos\\CodeMetrics.AI\\TestResults\\python-error-transfers-package-2026-10-15\\report-source",
          "entryPoint": "E:\\repos\\CodeMetrics.AI\\TestResults\\python-error-transfers-package-2026-10-15\\report-source"
        },
        "sourceFactsProducer": {
          "name": "codemetrics-ai/python-source-facts",
          "version": "0.4.0-experimental",
          "parser": "python-ast",
          "parserVersion": "3.12.10"
        },
        "sourceFactsPolicy": "python/owned-function-complexity-v2",
        "selection": {
          "policy": "python/source-selection-v1",
          "configurationFingerprint": "1d376bba0c4e13b51a1c1898d7200fdfb6cccdeeeef74cc2424fd0659b8d756e",
          "options": {
            "include": [],
            "exclude": [],
            "testPaths": [],
            "productionPaths": [],
            "includeTests": false,
            "includeGenerated": false,
            "includeSupport": false
          },
          "files": [
            {
              "file": "work.py",
              "category": "production",
              "disposition": "analyzed",
              "reason": "production-candidate",
              "contentSha256": "9e73b9bb057cb9084790e7c0ee8296f36fee657f1723bbf0477eb2f82b5eb8cb"
            }
          ],
          "prunedDirectories": [],
          "excludedFunctions": []
        },
        "diagnostics": [],
        "scope": "Exact whole-function AST bodies; names/literals retained; signatures, decorators, leading docstrings and locations excluded. Populations and async/sync kinds compared separately. Not semantic equivalence, partial-block detection, a duplication percentage, or a score.",
        "groups": [],
        "excludedFunctions": [
          {
            "id": "729b851b4511178828057670bc837e9f04138cbbe161bb6e70a2e793146dd0e6",
            "file": "work.py",
            "member": "bare",
            "line": 1,
            "population": "production",
            "endLine": 3,
            "statementCount": 3,
            "sourceSha256": "9e73b9bb057cb9084790e7c0ee8296f36fee657f1723bbf0477eb2f82b5eb8cb",
            "reason": "below-statement-minimum"
          },
          {
            "id": "de82093eac6d0ed1e12313e3c81b0b5546a7ac84a3b6302ad3d91b3677ba65da",
            "file": "work.py",
            "member": "same_name",
            "line": 6,
            "population": "production",
            "endLine": 8,
            "statementCount": 3,
            "sourceSha256": "9e73b9bb057cb9084790e7c0ee8296f36fee657f1723bbf0477eb2f82b5eb8cb",
            "reason": "below-statement-minimum"
          },
          {
            "id": "db2f6507126410a83bfa4ca6e8e20e16209a5f9e6ce97666b5418b62df8714dd",
            "file": "work.py",
            "member": "wrapped",
            "line": 11,
            "population": "production",
            "endLine": 13,
            "statementCount": 3,
            "sourceSha256": "9e73b9bb057cb9084790e7c0ee8296f36fee657f1723bbf0477eb2f82b5eb8cb",
            "reason": "below-statement-minimum"
          },
          {
            "id": "9cf92aa8a3f9a71c04d1355888de2a563e2b9bb531bfcdcd40b52999fa8723f3",
            "file": "work.py",
            "member": "caused",
            "line": 16,
            "population": "production",
            "endLine": 18,
            "statementCount": 3,
            "sourceSha256": "9e73b9bb057cb9084790e7c0ee8296f36fee657f1723bbf0477eb2f82b5eb8cb",
            "reason": "below-statement-minimum"
          },
          {
            "id": "85ad94950a34f2f8bd4e918b2bcd130ab44bf9ef5e18623a518759b3f14e5d62",
            "file": "work.py",
            "member": "suppressed",
            "line": 21,
            "population": "production",
            "endLine": 24,
            "statementCount": 3,
            "sourceSha256": "9e73b9bb057cb9084790e7c0ee8296f36fee657f1723bbf0477eb2f82b5eb8cb",
            "reason": "below-statement-minimum"
          },
          {
            "id": "6ebc304dc59da4a742899cf049c2b268a8315b5d2d069973f7bd1dab83ecc673",
            "file": "work.py",
            "member": "finalized",
            "line": 35,
            "population": "production",
            "endLine": 38,
            "statementCount": 4,
            "sourceSha256": "9e73b9bb057cb9084790e7c0ee8296f36fee657f1723bbf0477eb2f82b5eb8cb",
            "reason": "below-statement-minimum"
          }
        ],
        "summary": {
          "selectedFunctions": 7,
          "eligibleFunctions": 1,
          "excludedFunctions": 6,
          "exclusionReasons": {
            "below-statement-minimum": 6
          },
          "duplicateGroups": 0,
          "matchedFunctions": 0
        }
      },
      "coverageReview": {
        "schemaVersion": 2,
        "artifactKind": "experimental-python-coverage-review",
        "producer": {
          "name": "codemetrics-ai/python-coverage-review",
          "version": "0.3.0-experimental"
        },
        "generatedAtUtc": "2026-10-15T15:36:29.939054+00:00",
        "runId": "fdaf3d3c-1104-4bc4-8871-4eead80eda10",
        "auditId": "fdaf3d3c-1104-4bc4-8871-4eead80eda10",
        "policy": "python/coveragepy-line-crap-review-v1",
        "configuration": {
          "policy": "python/coveragepy-line-crap-review-v1",
          "selectionFingerprint": "1d376bba0c4e13b51a1c1898d7200fdfb6cccdeeeef74cc2424fd0659b8d756e",
          "complexityPolicy": "python/owned-function-complexity-v2",
          "parserVersion": "3.12.10",
          "maxReportBytes": 33554432,
          "maxOwners": 100000
        },
        "configurationFingerprint": "a91ac8445336f143669529e0cd9adbbb17baa6aa07bcfcc0af6cd8bd5c0089e2",
        "status": "complete",
        "subject": {
          "root": "E:\\repos\\CodeMetrics.AI\\TestResults\\python-error-transfers-package-2026-10-15\\report-source",
          "entryPoint": "E:\\repos\\CodeMetrics.AI\\TestResults\\python-error-transfers-package-2026-10-15\\report-source"
        },
        "sourceFactsProducer": {
          "name": "codemetrics-ai/python-source-facts",
          "version": "0.4.0-experimental",
          "parser": "python-ast",
          "parserVersion": "3.12.10"
        },
        "selection": {
          "policy": "python/source-selection-v1",
          "configurationFingerprint": "1d376bba0c4e13b51a1c1898d7200fdfb6cccdeeeef74cc2424fd0659b8d756e",
          "options": {
            "include": [],
            "exclude": [],
            "testPaths": [],
            "productionPaths": [],
            "includeTests": false,
            "includeGenerated": false,
            "includeSupport": false
          },
          "files": [
            {
              "file": "work.py",
              "category": "production",
              "disposition": "analyzed",
              "reason": "production-candidate",
              "contentSha256": "9e73b9bb057cb9084790e7c0ee8296f36fee657f1723bbf0477eb2f82b5eb8cb"
            }
          ],
          "prunedDirectories": [],
          "excludedFunctions": []
        },
        "coverageInput": null,
        "collectionProvenance": null,
        "diagnostics": [],
        "scope": "Line-coverage CRAP review estimates, not scores or defect predictions. Imports without collection provenance have unverified source binding and freshness. New review IDs never authenticate historical coverage. Line coverage is not basis-path coverage or test effectiveness.",
        "functions": [
          {
            "id": "729b851b4511178828057670bc837e9f04138cbbe161bb6e70a2e793146dd0e6",
            "file": "work.py",
            "member": "bare",
            "line": 1,
            "population": "production",
            "endLine": 3,